{
  "language": "hinglish",
  "film_title": "Ek Tarfa Express",
  "tagline": "Tum reply karte rahe, woh 'dekhti hoon' karti rahi",
  "acts": [
    {
      "act": 1,
      "title": "Meet-cute",
      "text": "Pehle 8 hafte: 2 AM rallies of 40+ messages, and you said ❤️ first in week 6 ..."
    },
    {
      "act": 2,
      "title": "Interval twist",
      "text": "Week 9 changed the background score: their replies went from minutes to hours ..."
    },
    {
      "act": 3,
      "title": "Now showing",
      "text": "You still start 7 of 10 chats. They turn toward 61% of your bids ..."
    }
  ],
  "dynamics": {
    "chaser": "SELF",
    "momentum": "FADING",
    "confidence": 0.7
  },
  "milestone_notes": [
    {
      "id": "m1",
      "caption": "Week 9: replies went from minutes to hours"
    }
  ],
  "verdict": "Strong opening, slow second half. Let them write the next scene.",
  "advice": [
    "Let them start the next few conversations.",
    "Ask one follow-up question about something they said."
  ],
  "flags": {
    "boundary_signal": false
  }
}
